{
  "t": "hello",
  "v": 1,
  "token": "eyJhbGciOiJFUzI1NiIsInR5cCI6IkpXVCIsImtpZCI6Inpha2FkaS12ZWN0b3JzLXRlc3QtMSJ9.eyJpc3MiOiJhcGkuemFrYWRpLmRldiIsImF1ZCI6ImluZ2VzdCIsInN1YiI6InNlc18wMUs1Uk1RMkcwVkVDVDBSMDAwMDAwMDAwMSIsInRpZCI6InRlbmFudCIsImp0aSI6IkFBRUNBd1FGQmdjSUNRb0xEQTBPRHciLCJpYXQiOjE3NTg1NDI0MDAsIm5iZiI6MTc1ODU0MjQwMCwiZXhwIjoxNzU4NTQyNzAwLCJwb2wiOjEyLCJiYW5kX21heCI6IkIiLCJpbmciOlsiZXUtd2VzdC0yIl0sIm5vbmNlIjoiOEowd1l3Nk5NUXhSazRiM3d2a0FnQSIsImxhbmciOiJlbi1ORyJ9.it_qSLjo3Phxizz1zo6fOaEyfA0Xib3-MGT61di4kvVk0OIq_vw0arq15MxNXdMuiieNR5P9XsoXeN51vutYxw",
  "sdk": {
    "platform": "web",
    "name": "@zakadi/web-core",
    "version": "1.4.2",
    "os": "Android 13",
    "device": "TECNO KI5q",
    "browser": "Chrome 128",
    "wrapper": {
      "name": "@zakadi/react",
      "version": "1.0.3"
    }
  },
  "caps": {
    "profile": "webcodecs",
    "video": [
      "avc1.42E01F",
      "vp8"
    ],
    "audio": [
      "opus",
      "aac"
    ],
    "hw_encode": true,
    "keyframe_on_demand": true,
    "bitrate_reconfig": true,
    "max_resolution": {
      "w": 720,
      "h": 1280
    },
    "max_fps": 30,
    "attestation": "none"
  },
  "prompt_pack": {
    "lang": "en-NG",
    "version": "2026.09.1"
  },
  "a11y": {
    "screen_reader": false,
    "captions": true,
    "reduced_motion": false,
    "extended_time": false
  },
  "consent": {
    "biometric": true,
    "recording": true,
    "at_ms_wall": 1758542400000
  }
}
